{
  "fact_sources": {
    "water_type": "osm"
  },
  "facts": {
    "water_type": "fountain"
  },
  "group": "utility",
  "id": "ocdb_01M66ESCB3YX3FBRFV4HD764CG",
  "kind": "drinking_water_point",
  "location": {
    "lat": -35.415696,
    "lon": 149.067858
  },
  "name": null,
  "osm": {
    "id": 8369810264,
    "type": "node",
    "version": 1
  },
  "rating": null,
  "status": "open",
  "updated": "2026-10-30T14:16:00Z"
}
