{
  "fact_sources": {},
  "facts": {},
  "group": "services",
  "id": "ocdb_01M66JPKQXRJK07YZK838R82YD",
  "kind": "fuel",
  "location": {
    "lat": -32.315022,
    "lon": 115.753265
  },
  "name": "Shell",
  "osm": {
    "id": 11862055265,
    "type": "node",
    "version": 1
  },
  "rating": null,
  "status": "open",
  "updated": "2026-10-30T14:16:00Z"
}
