{
  "fact_sources": {},
  "facts": {},
  "group": "attraction",
  "id": "ocdb_01M66JP2X2131NAZSA6YGZ7PNQ",
  "kind": "lookout",
  "location": {
    "lat": -34.451597,
    "lon": 150.412177
  },
  "name": "The GIB Lookout",
  "osm": {
    "id": 1862629166,
    "type": "node",
    "version": 4
  },
  "rating": null,
  "status": "open",
  "updated": "2026-10-30T14:16:00Z"
}
