{
  "fact_sources": {},
  "facts": {},
  "group": "utility",
  "id": "ocdb_01M66ESEPG3JRRFS7M38R7RYFA",
  "kind": "public_toilet",
  "location": {
    "lat": -27.283621,
    "lon": 152.950264
  },
  "name": null,
  "osm": {
    "id": 14308019651,
    "type": "node",
    "version": 2
  },
  "rating": null,
  "status": "open",
  "updated": "2026-10-30T14:16:00Z"
}
