{
  "fact_sources": {},
  "facts": {},
  "group": "attraction",
  "id": "ocdb_01M66JP0RKP83Y1J738ZTHFYMS",
  "kind": "lookout",
  "location": {
    "lat": -32.739687,
    "lon": 138.602895
  },
  "name": "Tank Hill Lookout",
  "osm": {
    "id": 1330880867,
    "type": "node",
    "version": 1
  },
  "rating": null,
  "status": "open",
  "updated": "2026-10-30T14:16:00Z"
}
