{
  "fact_sources": {
    "entry": "osm"
  },
  "facts": {
    "entry": "public"
  },
  "group": "utility",
  "id": "ocdb_01M66ESG009NG23FWQBN5WQ7Y7",
  "kind": "public_toilet",
  "location": {
    "lat": -37.409193,
    "lon": 147.26499
  },
  "name": null,
  "osm": {
    "id": 1167481784,
    "type": "way",
    "version": 2
  },
  "rating": null,
  "status": "open",
  "updated": "2026-10-30T14:16:00Z"
}
