{
  "fact_sources": {},
  "facts": {},
  "group": "services",
  "id": "ocdb_01M66JPVBHVFZ5G3KHTQ7YFB6J",
  "kind": "fuel",
  "location": {
    "lat": -32.788427,
    "lon": 151.902227
  },
  "name": "Small Vehicle Refuelling Area",
  "osm": {
    "id": 545582537,
    "type": "way",
    "version": 1
  },
  "rating": null,
  "status": "open",
  "updated": "2026-10-30T14:16:00Z"
}
