{
  "fact_sources": {},
  "facts": {},
  "group": "attraction",
  "id": "ocdb_01M66JPEQVMAJWXZAMTF8ZA3ZZ",
  "kind": "attraction",
  "location": {
    "lat": -20.051494,
    "lon": 138.183691
  },
  "name": "Caves",
  "osm": {
    "id": 8947588317,
    "type": "node",
    "version": 1
  },
  "rating": null,
  "status": "open",
  "updated": "2026-10-30T14:16:00Z"
}
