{
  "fact_sources": {
    "opening_hours": "osm",
    "phone": "osm",
    "website": "osm"
  },
  "facts": {
    "opening_hours": "24/7",
    "phone": "+61 7 4912 5100",
    "website": "https://www.cq.health.qld.gov.au/hospitals-and-health-centres/mount-morgan-multipurpose-health-service"
  },
  "group": "emergency",
  "id": "ocdb_01M66JPZWFH412VAP51MH38KG1",
  "kind": "hospital_emergency",
  "location": {
    "lat": -23.645281,
    "lon": 150.392897
  },
  "name": "Mount Morgan Multipurpose Health Service",
  "osm": {
    "id": 1477801220,
    "type": "way",
    "version": 2
  },
  "rating": null,
  "status": "open",
  "updated": "2026-10-30T14:16:00Z"
}
