{
  "fact_sources": {},
  "facts": {},
  "group": "services",
  "id": "ocdb_01M66JPRQ45435NP9MWC08RDA0",
  "kind": "fuel",
  "location": {
    "lat": -31.770933,
    "lon": 116.028581
  },
  "name": "Ginger's Roadhouse",
  "osm": {
    "id": 174695506,
    "type": "way",
    "version": 3
  },
  "rating": null,
  "status": "open",
  "updated": "2026-10-30T14:16:00Z"
}
