{
  "fact_sources": {},
  "facts": {},
  "group": "utility",
  "id": "ocdb_01M66ES9DE27GVT8X7JNSKHJSA",
  "kind": "picnic_site",
  "location": {
    "lat": -38.811646,
    "lon": 146.268012
  },
  "name": "Duck Point Picnic Area",
  "osm": {
    "id": 772561186,
    "type": "node",
    "version": 2
  },
  "rating": null,
  "status": "open",
  "updated": "2026-10-30T14:16:00Z"
}
