{
  "fact_sources": {},
  "facts": {},
  "group": "utility",
  "id": "ocdb_01M66ESFVKK7NQTDKP6XP4CS07",
  "kind": "public_toilet",
  "location": {
    "lat": -27.369665,
    "lon": 152.852401
  },
  "name": null,
  "osm": {
    "id": 1058100292,
    "type": "way",
    "version": 2
  },
  "rating": null,
  "status": "open",
  "updated": "2026-10-30T14:16:00Z"
}
