{
  "fact_sources": {},
  "facts": {},
  "group": "attraction",
  "id": "ocdb_01M66JNXMBX9656CCHE0EYBFDY",
  "kind": "boat_ramp",
  "location": {
    "lat": -34.062041,
    "lon": 151.079468
  },
  "name": "Grays Point Boat Ramp",
  "osm": {
    "id": 291136209,
    "type": "node",
    "version": 7
  },
  "rating": null,
  "status": "open",
  "updated": "2026-10-30T14:16:00Z"
}
