{
  "fact_sources": {
    "fee": "osm"
  },
  "facts": {
    "fee": false
  },
  "group": "utility",
  "id": "ocdb_01M66ESE6JEKVYTWC14JYBM3FC",
  "kind": "public_toilet",
  "location": {
    "lat": -35.174658,
    "lon": 149.273545
  },
  "name": null,
  "osm": {
    "id": 13191832457,
    "type": "node",
    "version": 3
  },
  "rating": null,
  "status": "open",
  "updated": "2026-10-30T14:16:00Z"
}
