{
  "fact_sources": {},
  "facts": {},
  "group": "attraction",
  "id": "ocdb_01M66JNZR3CRT00NAFYBDYVMNX",
  "kind": "boat_ramp",
  "location": {
    "lat": -40.85653,
    "lon": 145.502194
  },
  "name": null,
  "osm": {
    "id": 813170264,
    "type": "node",
    "version": 3
  },
  "rating": null,
  "status": "open",
  "updated": "2026-10-30T14:16:00Z"
}
