{
  "fact_sources": {
    "entry": "osm"
  },
  "facts": {
    "entry": "public"
  },
  "group": "utility",
  "id": "ocdb_01M66ESEGHK7JGQGWKE9RMV7YY",
  "kind": "public_toilet",
  "location": {
    "lat": -25.591735,
    "lon": 151.299364
  },
  "name": "Mundubbera Community Hall",
  "osm": {
    "id": 13916536293,
    "type": "node",
    "version": 1
  },
  "rating": null,
  "status": "open",
  "updated": "2026-10-30T14:16:00Z"
}
