{
  "fact_sources": {
    "opening_hours": "osm",
    "phone": "osm",
    "website": "osm"
  },
  "facts": {
    "opening_hours": "24/7",
    "phone": "+61 2 9971 7660",
    "website": "https://www.7eleven.com.au/stores?s=2099"
  },
  "group": "services",
  "id": "ocdb_01M66JPVZT1Z1T9GGHNSHX0CTR",
  "kind": "fuel",
  "location": {
    "lat": -33.749147,
    "lon": 151.290205
  },
  "name": "7-Eleven Dee Why",
  "osm": {
    "id": 670211801,
    "type": "way",
    "version": 5
  },
  "rating": null,
  "status": "open",
  "updated": "2026-10-30T14:16:00Z"
}
