{
  "fact_sources": {},
  "facts": {},
  "group": "attraction",
  "id": "ocdb_01M66JPJWVKS1NNHB2P1CW118R",
  "kind": "attraction",
  "location": {
    "lat": -32.547544,
    "lon": 151.940944
  },
  "name": "Farmers Wife Distillery",
  "osm": {
    "id": 11404704272,
    "type": "node",
    "version": 1
  },
  "rating": null,
  "status": "open",
  "updated": "2026-10-30T14:16:00Z"
}
