{
  "fact_sources": {},
  "facts": {},
  "group": "attraction",
  "id": "ocdb_01M66JPKYXNCT7WN87WY08CKY1",
  "kind": "attraction",
  "location": {
    "lat": -22.51521,
    "lon": 143.038089
  },
  "name": "Bladensburg Homestead",
  "osm": {
    "id": 11989704347,
    "type": "node",
    "version": 1
  },
  "rating": null,
  "status": "open",
  "updated": "2026-10-30T14:16:00Z"
}
