{
  "fact_sources": {},
  "facts": {},
  "group": "services",
  "id": "ocdb_01M66JPHE2BFG0CRC4WVT2KSRA",
  "kind": "mechanic",
  "location": {
    "lat": -31.091398,
    "lon": 116.451146
  },
  "name": "Calingiri Auto Centre",
  "osm": {
    "id": 10572239807,
    "type": "node",
    "version": 1
  },
  "rating": null,
  "status": "open",
  "updated": "2026-10-30T14:16:00Z"
}
