{
  "fact_sources": {
    "caravans": "osm",
    "entry": "osm",
    "fee": "osm",
    "max_stay": "osm",
    "pets": "osm",
    "phone": "osm",
    "power": "osm",
    "showers": "osm",
    "tents": "osm",
    "toilets": "osm",
    "website": "osm"
  },
  "facts": {
    "caravans": true,
    "entry": "customers",
    "fee": true,
    "max_stay": "7d",
    "pets": "leashed",
    "phone": "+61 499 885 788",
    "power": true,
    "showers": true,
    "tents": true,
    "toilets": true,
    "website": "https://sandstonewonders.com/discover/camp-goovigen-recreation-grounds/"
  },
  "group": "overnight",
  "id": "ocdb_01M66ES9ZTJCTYPKSE8QTM7RB9",
  "kind": "paid_campground",
  "location": {
    "lat": -24.1454,
    "lon": 150.285477
  },
  "name": "Goovigen Sportsground",
  "osm": {
    "id": 1811177436,
    "type": "node",
    "version": 8
  },
  "rating": null,
  "status": "open",
  "updated": "2026-10-30T14:16:00Z"
}
