{
  "fact_sources": {},
  "facts": {},
  "group": "attraction",
  "id": "ocdb_01M66JP17R90Y1GKVKBDYZGD5R",
  "kind": "lookout",
  "location": {
    "lat": -33.45064,
    "lon": 151.403907
  },
  "name": "Colin Watters Lookout",
  "osm": {
    "id": 1551528715,
    "type": "node",
    "version": 2
  },
  "rating": null,
  "status": "open",
  "updated": "2026-10-30T14:16:00Z"
}
