{
  "fact_sources": {
    "pets": "osm",
    "water_type": "osm"
  },
  "facts": {
    "pets": "yes",
    "water_type": "fountain"
  },
  "group": "utility",
  "id": "ocdb_01M66ESC6BWEGDE9EJXM3EYFYX",
  "kind": "drinking_water_point",
  "location": {
    "lat": -38.141074,
    "lon": 144.35832
  },
  "name": null,
  "osm": {
    "id": 7775103977,
    "type": "node",
    "version": 4
  },
  "rating": null,
  "status": "open",
  "updated": "2026-10-30T14:16:00Z"
}
