{
  "fact_sources": {},
  "facts": {},
  "group": "utility",
  "id": "ocdb_01M66ESA9DD6PF8YX7ESY6FWJ2",
  "kind": "picnic_site",
  "location": {
    "lat": -37.739832,
    "lon": 144.995012
  },
  "name": null,
  "osm": {
    "id": 2172932660,
    "type": "node",
    "version": 1
  },
  "rating": null,
  "status": "open",
  "updated": "2026-10-30T14:16:00Z"
}
